名称,功能描述,Setapp链接,官方网站,官方订阅价格,评分,平台
Supercharge,为Mac系统提供强大的增强功能和自定义选项。通过丰富的插件系统和快捷操作，显著提升Mac的使用效率和个性化体验。支持多种系统级优化和便捷工具集成。,https://setapp.com/apps/supercharge,https://sindresorhus.com/supercharge,0,100,Mac
Code Snippets AI,基于人工智能的代码片段管理和优化工具。自动检测代码问题并提供智能修复建议，支持多种编程语言的代码整理和格式化。帮助开发者提高代码质量和开发效率。,https://setapp.com/apps/code-snippets-ai,https://codesnippetsai.com,9.99,100,Mac
Bartender,专业的Mac菜单栏管理工具，让你完全控制菜单栏图标的显示和隐藏。支持自定义排列、分组管理和快速访问，保持菜单栏整洁有序。提供多种显示模式和个性化设置选项。,https://setapp.com/apps/bartender,https://www.macbartender.com,联系官方获取价格,99,Mac
CleanShot X,功能强大的截图和屏幕录制工具，支持多种截图模式和编辑功能。内置标注工具、模糊处理、水印添加等专业功能，可直接生成高质量的GIF动画。提供云端存储和快速分享功能。,https://setapp.com/apps/cleanshot,https://cleanshot.com,29,99,Mac
TextSniper,先进的OCR文字识别工具，能够从图片、视频、PDF等各种视觉内容中准确提取文字。支持多种语言识别，提供实时翻译和文本编辑功能。特别适合处理无法复制的文本内容。,https://setapp.com/apps/textsniper,https://textsniper.app,9.99,99,Mac
Numi,智能计算器和单位转换工具，支持自然语言输入和复杂数学运算。提供货币汇率、单位换算、时间计算等多种实用功能，界面简洁直观。支持历史记录和自定义变量，适合日常计算需求。,https://setapp.com/apps/numi,https://numi.app,21,99,Mac
Ulysses,专业的写作和发布平台，提供优雅的Markdown编辑环境和强大的文档管理功能。支持多平台同步、目标设置、发布到各大平台等功能。特别适合作家、博主和内容创作者使用。,https://setapp.com/apps/ulysses,https://ulysses.app,订阅：$5-6/月 或 $40-49.99/年,99,"Mac, iOS"
TablePlus,现代化的数据库管理工具，支持MySQL、PostgreSQL、SQLite等多种数据库系统。提供直观的图形界面、强大的查询编辑器和数据可视化功能。支持SSH连接、数据导入导出和团队协作。,https://setapp.com/apps/tableplus,https://tableplus.com,一次性购买：基础版$99，标准版$129，团队版$59/座位,99,Mac
MindNode Classic,优雅的思维导图和头脑风暴工具，帮助整理思路和可视化想法。提供丰富的节点样式、连接线和布局选项，支持多媒体内容插入。适合项目规划、学习笔记和创意构思。,https://setapp.com/apps/mindnode,https://mindnode.com,19.99,99,"Mac, iOS"
Yoink,增强Mac拖放功能的实用工具，提供临时存储区域来改善文件操作体验。支持多种文件类型的暂存和批量操作，简化复杂的拖放任务。特别适合频繁进行文件整理和移动的用户。,https://setapp.com/apps/yoink,https://eternalstorms.at/yoink,7.99,99,Mac
DevUtils,面向开发者的离线工具集合，包含JSON格式化、Base64编解码、哈希计算等常用功能。无需网络连接即可使用，保护数据隐私和安全。提供简洁的界面和快速的处理速度。,https://setapp.com/apps/devutils.app,https://devutils.app,9.99,99,Mac
Lungo,防止Mac自动休眠的小工具，通过菜单栏图标一键控制系统睡眠状态。支持定时唤醒、条件触发等高级功能，适合需要长时间运行任务的场景。轻量级设计，不影响系统性能。,https://setapp.com/apps/lungo,https://sindresorhus.com/lungo,0,99,Mac
PixelSnap,精确的屏幕测量工具，帮助设计师和开发者测量屏幕上任何元素的尺寸和距离。提供像素级精度、多种测量模式和标注功能。支持颜色拾取、坐标显示和测量结果导出。,https://setapp.com/apps/pixelsnap,https://getpixelsnap.com,9.99,99,Mac
Dash,离线API文档浏览器，为开发者提供快速的文档查询和代码片段管理功能。支持150+编程语言和框架的文档，提供强大的搜索和书签功能。可与多种代码编辑器集成使用。,https://setapp.com/apps/dash,https://kapeli.com/dash,订阅：¥200/月（按年计费）,99,Mac
Dropzone,拖放增强工具，通过可自定义的拖放区域简化日常文件操作任务。支持文件上传、图片压缩、文本处理等多种动作，可创建自定义脚本。提高文件处理效率和工作流程自动化。,https://setapp.com/apps/dropzone,https://aptonic.com,19.99,99,Mac
HazeOver,窗口焦点管理工具，自动使非活动窗口变暗以突出当前工作窗口。帮助用户专注于当前任务，减少视觉干扰。支持自定义透明度、排除应用和快捷键控制。,https://setapp.com/apps/hazeover,https://hazeover.com,4.99,99,Mac
Proxyman,专业的网络调试和抓包工具，帮助开发者分析HTTP/HTTPS流量和API调用。提供直观的界面、请求重写、断点调试等高级功能。支持移动设备调试和团队协作。,https://setapp.com/apps/proxyman,https://proxyman.io,49,99,"Mac, iOS"
Soulver,结合计算器和笔记本功能的智能计算工具，支持自然语言输入和上下文计算。可以在文本中直接进行数学运算，支持变量定义和复杂计算。适合财务分析、工程计算等场景。,https://setapp.com/apps/soulver,https://soulver.app,34.99,99,"Mac, iOS"
SnippetsLab,专业的代码片段管理工具，帮助开发者组织和快速访问常用代码。支持语法高亮、标签分类、全文搜索等功能。可与多种编辑器集成，提高编程效率和代码复用。,https://setapp.com/apps/snippetslab,https://www.renfei.org/snippets-lab,9.99,99,Mac
Dato,功能丰富的菜单栏日历和时间管理工具，显示多时区时间、日程安排和重要事件。支持自然语言事件创建、日历集成和提醒功能。界面简洁美观，高度可定制。,https://setapp.com/apps/dato,https://sindresorhus.com/dato,0,99,Mac
In Your Face,全屏会议提醒工具，确保重要会议和约会不被错过。提供醒目的全屏提醒界面，支持自定义提醒时间和重复设置。特别适合经常参加在线会议的用户。,https://setapp.com/apps/in-your-face,https://inyourface.app,4.99,99,Mac
TextSoap,强大的文本清理和格式化工具，自动检测和修复文本中的格式问题。支持多种清理规则、批量处理和自定义脚本。帮助用户快速整理从各种来源复制的文本内容。,https://setapp.com/apps/textsoap,https://www.unmarked.com/textsoap,44.95,99,Mac
IconJar,专业的图标管理和组织工具，帮助设计师高效管理大量图标资源。支持多种格式、标签分类、快速搜索和预览功能。可直接拖拽到设计软件中使用，提高设计工作流程效率。,https://setapp.com/apps/iconjar,https://geticonjar.com,19.99,99,Mac
SnapMotion,视频帧提取和快照工具，能够从视频文件中精确捕获高质量静态图像。支持批量处理、格式转换和质量调整。适合视频编辑、内容创作和素材收集等用途。,https://setapp.com/apps/snapmotion,https://www.snapmotion.app,9.99,99,"Mac, iOS"
Buildwatch,Xcode构建时间监控工具，帮助iOS开发者跟踪和优化项目编译性能。提供详细的构建统计、历史趋势和性能分析。帮助识别构建瓶颈，提高开发效率。,https://setapp.com/apps/buildwatch,https://buildwatch.app,4.99,99,Mac
Paste,智能剪贴板管理工具，自动保存和组织复制的内容历史。支持文本、图片、文件等多种格式，提供快速搜索和分类功能。跨设备同步，确保重要内容永不丢失。,https://setapp.com/apps/paste,https://pasteapp.io,14.99,98,"Mac, iOS"
Downie,专业的在线视频下载工具，支持YouTube、Vimeo等1000+网站的视频下载。提供多种格式和质量选项，支持批量下载和播放列表处理。界面简洁，操作便捷。,https://setapp.com/apps/downie,https://software.charliemonroe.net/downie,19.99,98,Mac
Permute,多媒体格式转换工具，支持音频、视频和图像的格式转换。提供预设配置、批量处理和质量优化功能。支持拖拽操作，转换速度快，输出质量高。,https://setapp.com/apps/permute,https://software.charliemonroe.net/permute,9.99,98,Mac
BetterTouchTool,强大的触控板、鼠标和键盘自定义工具，可创建复杂的手势和快捷操作。支持应用特定设置、条件触发和脚本执行。大幅提升Mac的操作效率和个性化体验。,https://setapp.com/apps/bettertouchtool,https://folivora.ai,22,98,Mac
AlDente Pro,电池健康管理工具，通过设置充电限制来延长MacBook电池寿命。提供详细的电池统计、温度监控和充电策略设置。帮助用户科学管理电池使用，保持最佳性能。,https://setapp.com/apps/aldente-pro,https://apphousekitchen.com,19.95,98,Mac
Session,基于番茄工作法的时间管理工具，帮助用户保持专注和提高工作效率。提供可自定义的工作和休息间隔、进度跟踪和统计分析。支持多平台同步和目标设置。,https://setapp.com/apps/session,https://www.stayinsession.com,4.99,98,"Mac, iOS"
Timing,自动时间跟踪工具，详细记录用户在各个应用和项目上花费的时间。提供智能分类、生产力分析和详细报告。帮助用户了解时间使用情况，优化工作效率。,https://setapp.com/apps/timing,https://timingapp.com,49,98,Mac
One Switch,快速访问macOS系统功能的便捷工具，通过菜单栏提供常用设置的一键切换。支持Wi-Fi、蓝牙、隐藏文件显示等多种系统功能。简化系统设置操作，提高使用效率。,https://setapp.com/apps/one-switch,https://fireball.studio/oneswitch,4.99,98,Mac
QuitAll,批量应用退出工具，一键关闭所有运行中的应用程序来释放系统资源。支持排除列表、智能检测和安全退出。帮助用户快速清理系统，提升Mac运行速度。,https://setapp.com/apps/quit-all-mac,https://amicoapps.com/app/quit-all,2.99,98,Mac
PDF Squeezer,PDF文件压缩工具，在保持文档质量的同时显著减小文件大小。支持批量处理、压缩级别调整和格式优化。特别适合需要分享或存储大量PDF文档的用户。,https://setapp.com/apps/pdf-squeezer,https://witt-software.com/pdfsqueezer,19.99,98,"Mac, iOS"
Pulltube,在线视频下载和编辑工具，支持从各大视频网站下载内容并进行简单编辑。提供视频剪辑、格式转换和质量调整功能。界面友好，操作简单。,https://setapp.com/apps/pulltube,https://www.pulltube.pl,9.99,98,Mac
Elmedia Player,功能全面的多媒体播放器，支持几乎所有音视频格式的播放。提供高级播放控制、字幕支持、在线流媒体播放等功能。界面现代化，播放质量优秀。,https://setapp.com/apps/elmedia-player,https://www.elmedia-video-player.com,19.95,98,Mac
PopClip,文本选择增强工具，在选中文本时显示便捷的操作菜单。支持复制、搜索、翻译、格式化等多种文本操作。可通过扩展添加更多功能，提高文本处理效率。,https://setapp.com/apps/popclip,https://pilotmoon.com/popclip,12.99,98,Mac
Mission Control Plus,增强Mission Control功能的工具，允许直接从Mission Control界面关闭窗口。简化窗口管理操作，提供更直观的多任务处理体验。支持键盘快捷键和自定义设置。,https://setapp.com/apps/mission-control-plus,https://fadel.io/missioncontrolplus,2.99,98,Mac
Movist Pro,专业的视频播放器，支持广泛的视频格式和编解码器。提供高质量播放、字幕支持、播放速度调节等功能。特别适合观看高清视频和外语影片。,https://setapp.com/apps/movist-pro,https://movistprime.com,4.99,98,Mac
HoudahSpot,增强的文件搜索工具，提供比Spotlight更强大和灵活的搜索功能。支持复杂搜索条件、文件属性筛选和搜索结果管理。帮助用户快速找到所需文件。,https://setapp.com/apps/houdahspot,https://www.houdah.com/houdahSpot,34,98,Mac
Typeface,字体管理和预览工具，帮助设计师和创作者管理大量字体资源。提供字体预览、分类管理、快速激活等功能。支持字体比较和样本生成，提高字体选择效率。,https://setapp.com/apps/typeface,https://typefaceapp.com,24.99,98,Mac
TouchRetouch,智能图像修复工具，能够轻松移除照片中的不需要对象和瑕疵。使用先进的算法自动填充移除区域，保持图像自然效果。操作简单，效果专业。,https://setapp.com/apps/touchretouch,https://www.adva-soft.com,9.99,98,Mac
Gifox,轻量级GIF录制工具，可快速捕获屏幕活动并生成高质量GIF动画。提供录制区域选择、帧率调整、文件大小优化等功能。特别适合制作教程和演示动画。,https://setapp.com/apps/gifox,https://gifox.io,4.99,98,Mac
Hand Mirror,一键摄像头预览工具，让用户在视频会议前快速检查摄像头画面。提供实时预览、画面调整和隐私保护功能。确保在重要会议中呈现最佳形象。,https://setapp.com/apps/hand-mirror,https://handmirror.app,9.99,98,Mac
Unclutter,桌面文件和笔记管理工具，提供隐藏的存储空间来整理临时文件和笔记。支持拖拽操作、剪贴板历史和快速笔记功能。帮助保持桌面整洁有序。,https://setapp.com/apps/unclutter,https://unclutterapp.com,19.99,98,Mac
TaskPaper,基于纯文本的任务管理工具，使用简单的标记语法来组织任务和项目。支持标签、搜索、过滤等功能，数据格式开放。适合喜欢文本编辑的用户进行任务管理。,https://setapp.com/apps/taskpaper,https://www.taskpaper.com,28.99,98,Mac
Bike,现代化的大纲编辑器，帮助用户组织想法、项目和文档结构。提供快速导航、折叠展开、多种视图模式等功能。支持导出多种格式，适合写作和项目规划。,https://setapp.com/apps/bike-outliner,https://www.hogbaysoftware.com/bike,29.99,98,Mac
Antinote,结合笔记和计算功能的智能工具，支持在笔记中进行数学运算和数据分析。提供Markdown支持、公式计算、图表生成等功能。适合学术研究和数据分析工作。,https://setapp.com/apps/antinote,https://antinote.app,9.99,98,Mac
Base,SQLite数据库管理工具，提供直观的界面来创建、编辑和查询SQLite数据库。支持数据导入导出、SQL编辑器、关系图显示等功能。适合开发者和数据分析师使用。,https://setapp.com/apps/base,https://menial.co.uk/base,29,98,Mac
Goldie App,黄金比例设计工具，帮助设计师在作品中应用黄金比例原理。提供多种比例模板、测量工具和设计指导。提升设计作品的美学质量和视觉平衡。,https://setapp.com/apps/goldie-app,https://goldieapp.com,4.99,98,Mac
CleanMyMac,专业的Mac系统清理和优化工具，深度扫描清理垃圾文件、恶意软件检测、应用卸载和系统优化。提供实时保护、性能监控和维护建议，保持Mac高性能运行。界面直观，操作安全可靠。,https://setapp.com/apps/cleanmymac,https://cleanmymac.com,订阅：$39.95-47.40/年 或 一次性购买：$129,97,Mac
iStat Menus,系统监控工具，实时显示CPU、内存、网络、存储等硬件状态信息。在菜单栏显示详细的系统信息，帮助用户监控Mac性能和温度。提供历史数据记录和警报功能。,https://setapp.com/apps/istat-menus,https://bjango.com/mac/istatmenus,18,97,Mac
Archiver,强大的文件压缩和解压工具，支持RAR、7Z、ZIP等多种压缩格式。提供密码保护、分卷压缩、批量处理等高级功能。界面简洁，处理速度快，兼容性强。,https://setapp.com/apps/archiver,https://archiverapp.com,19.99,97,Mac
SideNotes,屏幕侧边笔记工具，悬浮在屏幕边缘随时记录想法和信息。支持富文本编辑、快速访问、多笔记本管理等功能。不干扰当前工作，提高记录效率。,https://setapp.com/apps/sidenotes,https://www.apptorium.com/sidenotes,9.99,97,Mac
NotePlan,结合笔记和任务管理的生产力工具，支持Markdown语法、日历集成和项目规划功能。提供每日计划、任务跟踪、目标设置等功能，统一管理工作和生活安排。,https://setapp.com/apps/noteplan,https://noteplan.co,8.99,97,"Mac, iOS"
24 Hour Wallpaper,动态壁纸应用，提供100多种精美的时间感知壁纸。根据一天中的不同时间自动切换壁纸，营造沉浸式的视觉体验。支持自定义时间段和壁纸选择，让桌面始终保持新鲜感。,https://setapp.com/apps/24-hour-wallpaper,https://www.jetsoncreative.com/24hourwallpaper,4.99,97,Mac
Default Folder X,文件对话框增强工具，快速访问最近使用和收藏的文件夹。在打开或保存文件时提供便捷的导航选项，支持收藏夹管理和路径记忆。显著提升文件操作效率，减少重复导航。,https://setapp.com/apps/default-folder-x,https://www.stclairsoft.com/DefaultFolderX,39.95,97,Mac
OpenIn,浏览器选择工具，允许用户为不同类型的链接指定特定的浏览器。支持规则设置、域名匹配和自动选择功能。帮助用户在多个浏览器之间灵活切换，优化网页浏览体验。,https://setapp.com/apps/openin,https://loshadki.app/openin,9.99,97,Mac
Swish,触控板手势自定义工具，为MacBook用户提供丰富的触控板操作选项。支持窗口管理、应用切换、系统控制等多种手势动作。通过直观的手势操作，大幅提升Mac的使用效率和操作体验。,https://setapp.com/apps/swish,https://highlyopinionated.co/swish,16,97,Mac
TripMode,网络数据管理工具，帮助用户控制和节省互联网数据使用。可以阻止特定应用的网络访问，监控数据使用情况。特别适合使用移动热点或有限数据套餐的用户，有效避免流量超支。,https://setapp.com/apps/tripmode,https://www.tripmode.ch,7.99,97,Mac
Pareto Security,系统安全检查工具，自动扫描Mac的安全设置并提供改进建议。检查防火墙、系统更新、密码安全等多个方面。帮助用户维护系统安全，防范潜在的安全威胁和漏洞。,https://setapp.com/apps/pareto-security,https://paretosecurity.com,0,97,Mac
SQLPro Studio,多数据库管理工具，支持MySQL、PostgreSQL、Oracle、SQL Server等多种数据库系统。提供统一的管理界面、高级查询功能和数据可视化。适合数据库管理员和开发者进行复杂的数据库操作。,https://setapp.com/apps/sqlpro-studio,https://www.sqlprostudio.com,99.99,97,"Mac, iOS"
WiFi Explorer,无线网络分析和故障排除工具，帮助用户诊断和解决WiFi连接问题。提供网络信号强度、频道使用情况、干扰分析等详细信息。支持网络优化建议，确保最佳的无线网络性能。,https://setapp.com/apps/wifi-explorer,https://www.intuitibits.com/products/wifi-explorer,19.99,97,Mac
Magic Window Air,沉浸式屏保应用，提供令人惊叹的航拍风景和自然景观。通过高质量的视频内容，将Mac屏幕转变为观景窗口。支持多种场景选择和播放设置，为用户带来放松和愉悦的视觉体验。,https://setapp.com/apps/magic-window-air,https://magicwindow.app,9.99,97,Mac
Step Two,两步验证管理工具，简化和安全地管理各种账户的二次验证码。支持自动填充、备份恢复和多设备同步功能。提供直观的界面和强大的安全保护，确保账户安全的同时提升使用便利性。,https://setapp.com/apps/step-two,https://steptwo.app,9.99,97,"Mac, iOS"
Paletro,应用菜单命令快速访问工具，通过搜索界面快速找到和执行应用功能。支持模糊搜索、快捷键绑定和自定义命令。大幅提升应用操作效率，特别适合熟练用户和键盘操作爱好者。,https://setapp.com/apps/paletro,https://appmakes.io/paletro,9.99,97,Mac
Due,持续提醒和任务管理工具，确保重要事项不被遗忘。提供强制性提醒、重复设置和灵活的延迟选项。支持自然语言输入和多平台同步，帮助用户建立良好的时间管理习惯。,https://setapp.com/apps/due,https://www.dueapp.com,19.99,97,Mac
PhotoBulk,批量图片处理工具，支持图片大小调整、水印添加、格式转换等操作。提供简单的拖拽界面和丰富的处理选项，可同时处理大量图片。特别适合摄影师、设计师和需要批量处理图片的用户。,https://setapp.com/apps/photobulk,https://www.eltima.com/bulk-image-editor,19.95,97,Mac
Meta,音乐库管理工具，帮助用户编辑和组织音乐文件的元数据信息。支持专辑封面、艺术家信息、歌词编辑等功能。提供批量处理和自动识别功能，让音乐库保持整洁和完整的信息。,https://setapp.com/apps/meta,https://www.nightbirdsevolve.com/meta,19.99,97,Mac
Be Focused,番茄工作法时间管理工具，结合计时器和任务管理功能。提供工作和休息时间的自动切换，支持任务分类和进度跟踪。帮助用户保持专注，提高工作效率和时间管理能力。,https://setapp.com/apps/be-focused,https://xwavesoft.com/be-focused-pro-for-iphone-ipad-mac,2.99,97,Mac
Diarly,私人日记和生活记录应用，提供安全的写作环境和丰富的记录功能。支持照片插入、情绪标记、天气记录等多种元素。通过加密保护隐私，帮助用户养成记录生活的好习惯。,https://setapp.com/apps/diarly,https://diarly.app,14.99,97,"Mac, iOS"
SSH Config Editor,SSH配置文件管理工具，提供图形化界面来编辑和管理SSH连接配置。支持主机分组、连接测试和配置导入导出。简化SSH配置管理，提高远程服务器连接的效率和安全性。,https://setapp.com/apps/ssh-config-editor,https://hejki.org/ssheditor,9.99,97,Mac
Awesome Habits,习惯养成和跟踪工具，帮助用户建立和维持良好的生活习惯。提供习惯设置、进度跟踪、统计分析等功能。通过可视化的进度展示和提醒机制，激励用户坚持积极的生活方式。,https://setapp.com/apps/awesome-habits,https://awesomehabits.app,4.99,97,"Mac, iOS"
Merlin Project Express,项目管理和规划工具，适用于复杂项目的计划和执行。提供甘特图、资源管理、进度跟踪等专业功能。支持团队协作和多种导出格式，帮助项目经理有效管理大型项目。,https://setapp.com/apps/merlin-project-express,https://www.projectwizards.net/en/merlin-project,349,97,Mac
Godspeed,快速任务管理工具，专注于简单高效的任务处理。提供直观的任务列表、优先级设置和快速添加功能。支持多平台同步和智能提醒，帮助用户快速完成日常任务管理。,https://setapp.com/apps/godspeed,https://godspeedapp.com,9.99,97,"Mac, iOS"
Hype,HTML5动画和交互内容创建工具，无需编程即可制作专业的网页动画。提供时间轴编辑、响应式设计和丰富的动画效果。适合设计师和开发者创建引人注目的网页内容和交互体验。,https://setapp.com/apps/hype,https://tumult.com/hype4,99.99,97,Mac
Transloader,远程下载管理工具，允许用户在Mac上启动和管理远程下载任务。支持多种下载协议和远程服务器连接。特别适合需要在不同设备间协调下载任务的用户，提高下载管理效率。,https://setapp.com/apps/transloader,https://www.eternalstorms.at/transloader,19.99,97,Mac
BetterZip,创建和加密存档。这是一款功能丰富的Mac专业应用，为用户提供高效便捷的工作体验。通过直观的界面设计和强大的功能特性，显著提升用户的工作效率和使用满意度。,https://setapp.com/apps/betterzip,https://macitbetter.com,24.95,96,Mac
ForkLift,跨服务器管理文件。高效的文件管理和操作工具，提供强大的文件组织和处理功能。支持批量操作和高级文件管理选项，提升文件处理效率。,https://setapp.com/apps/forklift,https://binarynights.com,29.95,96,Mac
BusyCal,将任务与日历同步。这是一款功能丰富的Mac专业应用，为用户提供高效便捷的工作体验。通过直观的界面设计和强大的功能特性，显著提升用户的工作效率和使用满意度。,https://setapp.com/apps/busycal,https://www.busymac.com/busycal,49.99,96,Mac
AirBuddy,监控你的无线设备。这是一款功能丰富的Mac专业应用，为用户提供高效便捷的工作体验。通过直观的界面设计和强大的功能特性，显著提升用户的工作效率和使用满意度。,https://setapp.com/apps/airbuddy,https://v2.airbuddy.app,9.99,96,Mac
CodeRunner,更快编辑和运行代码。这是一款功能丰富的Mac专业应用，为用户提供高效便捷的工作体验。通过直观的界面设计和强大的功能特性，显著提升用户的工作效率和使用满意度。,https://setapp.com/apps/coderunner,https://coderunnerapp.com,19.99,96,Mac
Mate Translate,翻译任何内容。这是一款功能丰富的Mac专业应用，为用户提供高效便捷的工作体验。通过直观的界面设计和强大的功能特性，显著提升用户的工作效率和使用满意度。,https://setapp.com/apps/mate-translate,https://gikken.co/mate-translate,9.99,96,Mac
