名称,功能描述,Setapp链接,官方网站,官方订阅价格,评分,平台
Renamer,批量重命名文件。高效的文件管理和操作工具，提供强大的文件组织和处理功能。支持批量操作和高级文件管理选项，提升文件处理效率。,https://setapp.com/apps/renamer,https://renamer.com,19.99,96,Mac
Xnapper,创建可分享的截图。这是一款功能丰富的Mac专业应用，为用户提供高效便捷的工作体验。通过直观的界面设计和强大的功能特性，显著提升用户的工作效率和使用满意度。,https://setapp.com/apps/xnapper,https://xnapper.com,19.99,96,Mac
Hookmark,链接文件、网页、PDF。高效的文件管理和操作工具，提供强大的文件组织和处理功能。支持批量操作和高级文件管理选项，提升文件处理效率。,https://setapp.com/apps/hookmark,https://hookproductivity.com,59.99,96,Mac
KeyKey Typing Tutor,提升你的打字速度。这是一款功能丰富的Mac专业应用，为用户提供高效便捷的工作体验。通过直观的界面设计和强大的功能特性，显著提升用户的工作效率和使用满意度。,https://setapp.com/apps/keykey-typing-tutor,https://keykey.ninja,9.99,96,Mac
News Explorer,创建你的完美RSS源。这是一款功能丰富的Mac专业应用，为用户提供高效便捷的工作体验。通过直观的界面设计和强大的功能特性，显著提升用户的工作效率和使用满意度。,https://setapp.com/apps/news-explorer,https://betamagic.nl/products/newsexplorer.html,19.99,96,Mac
Expressions,使用正则表达式加速工作。这是一款功能丰富的Mac专业应用，为用户提供高效便捷的工作体验。通过直观的界面设计和强大的功能特性，显著提升用户的工作效率和使用满意度。,https://setapp.com/apps/expressions,https://www.apptorium.com/expressions,9.99,96,Mac
NetSpot,找到最佳网络连接。专业的网络管理和监控工具，提供详细的网络分析和优化功能。帮助用户诊断网络问题，确保最佳的网络性能和连接质量。,https://setapp.com/apps/netspot,https://www.netspotapp.com,49,96,Mac
Receipts,数字化收集文档。这是一款功能丰富的Mac专业应用，为用户提供高效便捷的工作体验。通过直观的界面设计和强大的功能特性，显著提升用户的工作效率和使用满意度。,https://setapp.com/apps/receipts,https://www.receipts-app.com,4.99,96,Mac
Whisk,带实时预览的代码编辑器。这是一款功能丰富的Mac专业应用，为用户提供高效便捷的工作体验。通过直观的界面设计和强大的功能特性，显著提升用户的工作效率和使用满意度。,https://setapp.com/apps/whisk,https://whisk-app.com,9.99,96,Mac
Usage,监控设备性能。这是一款功能丰富的Mac专业应用，为用户提供高效便捷的工作体验。通过直观的界面设计和强大的功能特性，显著提升用户的工作效率和使用满意度。,https://setapp.com/apps/usage,https://www.mediaatelier.com/Usage,4.99,96,"Mac, iOS"
PhotosRevive,为旧照片上色。强大的图片处理和管理工具，提供专业的编辑功能和批量处理能力。支持多种图片格式和高级滤镜效果，提升图片质量和视觉效果。,https://setapp.com/apps/photosrevive,https://neededapps.com/photosrevive,9.99,96,"Mac, iOS"
Paper,无干扰写作。专业的文本编辑和处理工具，提供丰富的编辑功能和格式支持。帮助用户高效处理文档内容，提升写作和编辑体验。,https://setapp.com/apps/paper,https://papereditor.app,4.99,96,"Mac, iOS"
SQLPro for SQLite,控制SQLite数据库。这是一款功能丰富的Mac专业应用，为用户提供高效便捷的工作体验。通过直观的界面设计和强大的功能特性，显著提升用户的工作效率和使用满意度。,https://setapp.com/apps/sqlpro-for-sqlite,https://www.sqlitepro.com,59.99,96,Mac
Studies,尝试智能学习笔记。这是一款功能丰富的Mac专业应用，为用户提供高效便捷的工作体验。通过直观的界面设计和强大的功能特性，显著提升用户的工作效率和使用满意度。,https://setapp.com/apps/studies,https://www.studiesapp.com,39.99,96,Mac
Flinto,设计交互式应用原型。这是一款功能丰富的Mac专业应用，为用户提供高效便捷的工作体验。通过直观的界面设计和强大的功能特性，显著提升用户的工作效率和使用满意度。,https://setapp.com/apps/flinto,https://www.flinto.com,99,96,Mac
Craft,创建和构建文档。这是一款功能丰富的Mac专业应用，为用户提供高效便捷的工作体验。通过直观的界面设计和强大的功能特性，显著提升用户的工作效率和使用满意度。,https://setapp.com/apps/craft,https://www.craft.do,9.99,95,"Mac, iOS, Web"
Folx,下载视频和种子。专业的视频处理工具，提供高质量的视频编辑和转换功能。支持多种视频格式和高级编辑选项，满足用户的视频制作需求。,https://setapp.com/apps/folx,https://mac.eltima.com/download-manager.html,19.95,95,Mac
Forecast Bar,接收天气警报。这是一款功能丰富的Mac专业应用，为用户提供高效便捷的工作体验。通过直观的界面设计和强大的功能特性，显著提升用户的工作效率和使用满意度。,https://setapp.com/apps/forecast-bar,https://forecastbar.com,4.99,95,Mac
Gitfox,通过优秀的差异比较更快提交。这是一款功能丰富的Mac专业应用，为用户提供高效便捷的工作体验。通过直观的界面设计和强大的功能特性，显著提升用户的工作效率和使用满意度。,https://setapp.com/apps/gitfox,https://www.gitfox.app,29.99,95,Mac
Timemator,按项目跟踪生产力。这是一款功能丰富的Mac专业应用，为用户提供高效便捷的工作体验。通过直观的界面设计和强大的功能特性，显著提升用户的工作效率和使用满意度。,https://setapp.com/apps/timemator,https://timemator.com,4.99,95,"Mac, iOS"
App Tamer,减少CPU使用率。这是一款功能丰富的Mac专业应用，为用户提供高效便捷的工作体验。通过直观的界面设计和强大的功能特性，显著提升用户的工作效率和使用满意度。,https://setapp.com/apps/app-tamer,https://www.stclairsoft.com/AppTamer,14.95,95,Mac
Commander One,双窗格文件管理器。高效的文件管理和操作工具，提供强大的文件组织和处理功能。支持批量操作和高级文件管理选项，提升文件处理效率。,https://setapp.com/apps/commander-one,https://mac.eltima.com/file-manager.html,29.99,95,Mac
Keysmith,为任何操作创建快捷方式。这是一款功能丰富的Mac专业应用，为用户提供高效便捷的工作体验。通过直观的界面设计和强大的功能特性，显著提升用户的工作效率和使用满意度。,https://setapp.com/apps/keysmith,https://www.keysmith.app,19.99,95,Mac
BoltAI,使用AI写作、编码、学习。专业的文本编辑和处理工具，提供丰富的编辑功能和格式支持。帮助用户高效处理文档内容，提升写作和编辑体验。,https://setapp.com/apps/boltai,https://boltai.com,20,95,Mac
ChronoSync Express,同步和备份文件夹。高效的文件管理和操作工具，提供强大的文件组织和处理功能。支持批量操作和高级文件管理选项，提升文件处理效率。,https://setapp.com/apps/chronosync-express,https://www.econtechnologies.com/chronosync/overview.html,49.99,95,Mac
Presentify,进行更好的演示。这是一款功能丰富的Mac专业应用，为用户提供高效便捷的工作体验。通过直观的界面设计和强大的功能特性，显著提升用户的工作效率和使用满意度。,https://setapp.com/apps/presentify,https://presentify.compzets.com,19.99,95,Mac
Time Out,提醒自己休息。这是一款功能丰富的Mac专业应用，为用户提供高效便捷的工作体验。通过直观的界面设计和强大的功能特性，显著提升用户的工作效率和使用满意度。,https://setapp.com/apps/time-out,https://www.dejal.com/timeout,9.99,95,Mac
start,更快打开任何应用。这是一款功能丰富的Mac专业应用，为用户提供高效便捷的工作体验。通过直观的界面设计和强大的功能特性，显著提升用户的工作效率和使用满意度。,https://setapp.com/apps/start,https://start.innovative-bytes.net,9.99,95,Mac
Trickster,快速访问最近文件。高效的文件管理和操作工具，提供强大的文件组织和处理功能。支持批量操作和高级文件管理选项，提升文件处理效率。,https://setapp.com/apps/trickster,https://www.apparentsoft.com/trickster,19.99,95,Mac
iFlicks,将视频上传到iTunes。专业的视频处理工具，提供高质量的视频编辑和转换功能。支持多种视频格式和高级编辑选项，满足用户的视频制作需求。,https://setapp.com/apps/iflicks,https://iflicksapp.com,19.99,95,Mac
Euclid,使用Excel公式计算。这是一款功能丰富的Mac专业应用，为用户提供高效便捷的工作体验。通过直观的界面设计和强大的功能特性，显著提升用户的工作效率和使用满意度。,https://setapp.com/apps/euclid,https://euclidapp.com,9.99,95,"Mac, iOS"
Glyphs Mini,编辑和管理图标设计。这是一款功能丰富的Mac专业应用，为用户提供高效便捷的工作体验。通过直观的界面设计和强大的功能特性，显著提升用户的工作效率和使用满意度。,https://setapp.com/apps/glyphs-mini,https://glyphsapp.com/glyphs-mini,49.99,95,Mac
Novabench,评估计算机性能。这是一款功能丰富的Mac专业应用，为用户提供高效便捷的工作体验。通过直观的界面设计和强大的功能特性，显著提升用户的工作效率和使用满意度。,https://setapp.com/apps/novabench,https://novabench.com,0,95,Mac
Asset Catalog Creator Pro,准备图标和应用资源。这是一款功能丰富的Mac专业应用，为用户提供高效便捷的工作体验。通过直观的界面设计和强大的功能特性，显著提升用户的工作效率和使用满意度。,https://setapp.com/apps/asset-catalog-creator-pro,https://www.bridgetech.io/asset-catalog-creator,9.99,95,Mac
Sip,为你的设计选择颜色。这是一款功能丰富的Mac专业应用，为用户提供高效便捷的工作体验。通过直观的界面设计和强大的功能特性，显著提升用户的工作效率和使用满意度。,https://setapp.com/apps/sip,https://sipapp.io,10,94,Mac
Endurance,延长你的电池寿命。这是一款功能丰富的Mac专业应用，为用户提供高效便捷的工作体验。通过直观的界面设计和强大的功能特性，显著提升用户的工作效率和使用满意度。,https://setapp.com/apps/endurance,https://enduranceapp.com,19.99,94,Mac
Mockuuups Studio,为所有设备生成模型。这是一款功能丰富的Mac专业应用，为用户提供高效便捷的工作体验。通过直观的界面设计和强大的功能特性，显著提升用户的工作效率和使用满意度。,https://setapp.com/apps/mockuuups-studio,https://mockuuups.studio,12,94,Mac
Marked,实时Markdown预览。这是一款功能丰富的Mac专业应用，为用户提供高效便捷的工作体验。通过直观的界面设计和强大的功能特性，显著提升用户的工作效率和使用满意度。,https://setapp.com/apps/marked,https://marked2app.com,13.99,94,Mac
Lofi Garden,一键播放lo-fi音乐。专业的音频处理和音乐管理工具，支持多种音频格式和高质量播放。提供丰富的音频编辑功能和音乐库管理选项。,https://setapp.com/apps/lofi-garden,https://lofigarden.app,4.99,94,Mac
ToothFairy,更快连接蓝牙设备。这是一款功能丰富的Mac专业应用，为用户提供高效便捷的工作体验。通过直观的界面设计和强大的功能特性，显著提升用户的工作效率和使用满意度。,https://setapp.com/apps/toothfairy,https://c-command.com/toothfairy,4.99,94,Mac
Workspaces,一键设置你的工作。这是一款功能丰富的Mac专业应用，为用户提供高效便捷的工作体验。通过直观的界面设计和强大的功能特性，显著提升用户的工作效率和使用满意度。,https://setapp.com/apps/workspaces,https://www.apptorium.com/workspaces,9.99,94,Mac
MenubarX,从菜单栏浏览网页。这是一款功能丰富的Mac专业应用，为用户提供高效便捷的工作体验。通过直观的界面设计和强大的功能特性，显著提升用户的工作效率和使用满意度。,https://setapp.com/apps/menubarx,https://menubarx.app,9.99,94,Mac
Clariti,通过声音提升心理清晰度。这是一款功能丰富的Mac专业应用，为用户提供高效便捷的工作体验。通过直观的界面设计和强大的功能特性，显著提升用户的工作效率和使用满意度。,https://setapp.com/apps/clariti,https://clariti.app,4.99,94,Mac
Movie Explorer Pro,策划你的电影收藏。这是一款功能丰富的Mac专业应用，为用户提供高效便捷的工作体验。通过直观的界面设计和强大的功能特性，显著提升用户的工作效率和使用满意度。,https://setapp.com/apps/movie-explorer-pro,https://www.movieexplorer.app,9.99,94,Mac
GlueMotion,将照片转换为延时摄影。强大的图片处理和管理工具，提供专业的编辑功能和批量处理能力。支持多种图片格式和高级滤镜效果，提升图片质量和视觉效果。,https://setapp.com/apps/gluemotion,https://gluemotion.com,9.99,94,Mac
ScreenFloat,增强你的截图功能。这是一款功能丰富的Mac专业应用，为用户提供高效便捷的工作体验。通过直观的界面设计和强大的功能特性，显著提升用户的工作效率和使用满意度。,https://setapp.com/apps/screenfloat,https://screenfloat.com,9.99,94,Mac
PocketCAS,解决高级数学方程。这是一款功能丰富的Mac专业应用，为用户提供高效便捷的工作体验。通过直观的界面设计和强大的功能特性，显著提升用户的工作效率和使用满意度。,https://setapp.com/apps/pocketcas,https://pocketcas.com,14.99,94,Mac
Gemini,查找和删除重复文件。高效的文件管理和操作工具，提供强大的文件组织和处理功能。支持批量操作和高级文件管理选项，提升文件处理效率。,https://setapp.com/apps/gemini,https://macpaw.com/gemini,19.95,93,Mac
BusyContacts,构建你的联系人数据库。这是一款功能丰富的Mac专业应用，为用户提供高效便捷的工作体验。通过直观的界面设计和强大的功能特性，显著提升用户的工作效率和使用满意度。,https://setapp.com/apps/busycontacts,https://www.busymac.com/busycontacts,49.99,93,Mac
Core Shell,全功能SSH终端。这是一款功能丰富的Mac专业应用，为用户提供高效便捷的工作体验。通过直观的界面设计和强大的功能特性，显著提升用户的工作效率和使用满意度。,https://setapp.com/apps/core-shell,https://coreshell.app,9.99,93,Mac
Prizmo,扫描和OCR任何文档。这是一款功能丰富的Mac专业应用，为用户提供高效便捷的工作体验。通过直观的界面设计和强大的功能特性，显著提升用户的工作效率和使用满意度。,https://setapp.com/apps/prizmo,https://www.creaceed.com/prizmo,59.99,93,"Mac, iOS"
2Do,安排任务和提醒。这是一款功能丰富的Mac专业应用，为用户提供高效便捷的工作体验。通过直观的界面设计和强大的功能特性，显著提升用户的工作效率和使用满意度。,https://setapp.com/apps/2do,https://www.2doapp.com,49.99,93,Mac
GoodTask,将待办事项与提醒同步。这是一款功能丰富的Mac专业应用，为用户提供高效便捷的工作体验。通过直观的界面设计和强大的功能特性，显著提升用户的工作效率和使用满意度。,https://setapp.com/apps/goodtask,https://goodtaskapp.com,39.99,93,Mac
Noizio,开启环境声音以专注。这是一款功能丰富的Mac专业应用，为用户提供高效便捷的工作体验。通过直观的界面设计和强大的功能特性，显著提升用户的工作效率和使用满意度。,https://setapp.com/apps/noizio,https://noiz.io,9.99,93,Mac
MetaImage,编辑图像元数据。这是一款功能丰富的Mac专业应用，为用户提供高效便捷的工作体验。通过直观的界面设计和强大的功能特性，显著提升用户的工作效率和使用满意度。,https://setapp.com/apps/metaimage,https://neededapps.com/metaimage,9.99,93,Mac
Swift Publisher,自助出版书籍或小册子。这是一款功能丰富的Mac专业应用，为用户提供高效便捷的工作体验。通过直观的界面设计和强大的功能特性，显著提升用户的工作效率和使用满意度。,https://setapp.com/apps/swift-publisher,https://www.belightsoft.com/products/swiftpublisher,19.99,93,Mac
Focused,专注于你的写作。专业的文本编辑和处理工具，提供丰富的编辑功能和格式支持。帮助用户高效处理文档内容，提升写作和编辑体验。,https://setapp.com/apps/focused,https://www.codebots.co.uk/focused,19.99,93,Mac
Pagico,管理团队和项目。这是一款功能丰富的Mac专业应用，为用户提供高效便捷的工作体验。通过直观的界面设计和强大的功能特性，显著提升用户的工作效率和使用满意度。,https://setapp.com/apps/pagico,https://www.pagico.com,49.99,93,Mac
MarsEdit,离线创建你的文本内容。专业的文本编辑和处理工具，提供丰富的编辑功能和格式支持。帮助用户高效处理文档内容，提升写作和编辑体验。,https://setapp.com/apps/marsedit,https://redsweater.com/marsedit,49.95,93,Mac
Cloud Outliner,创建可视化大纲。这是一款功能丰富的Mac专业应用，为用户提供高效便捷的工作体验。通过直观的界面设计和强大的功能特性，显著提升用户的工作效率和使用满意度。,https://setapp.com/apps/cloud-outliner,https://cloudoutliner.com,9.99,93,Mac
XCOrganizer,整理Xcode项目。这是一款功能丰富的Mac专业应用，为用户提供高效便捷的工作体验。通过直观的界面设计和强大的功能特性，显著提升用户的工作效率和使用满意度。,https://setapp.com/apps/xcorganizer,https://xcorganizer.com,9.99,93,Mac
Mosaic,自动整理窗口。这是一款功能丰富的Mac专业应用，为用户提供高效便捷的工作体验。通过直观的界面设计和强大的功能特性，显著提升用户的工作效率和使用满意度。,https://setapp.com/apps/mosaic,https://www.lightpillar.com/mosaic.html,9.99,92,Mac
Path Finder,复制、删除和同步文件。高效的文件管理和操作工具，提供强大的文件组织和处理功能。支持批量操作和高级文件管理选项，提升文件处理效率。,https://setapp.com/apps/path-finder,https://cocoatech.io,39.95,92,Mac
CloudMounter,将云存储连接到Finder。这是一款功能丰富的Mac专业应用，为用户提供高效便捷的工作体验。通过直观的界面设计和强大的功能特性，显著提升用户的工作效率和使用满意度。,https://setapp.com/apps/cloudmounter,https://cloudmounter.net,44.99,92,Mac
Squash,压缩和调整图像大小。这是一款功能丰富的Mac专业应用，为用户提供高效便捷的工作体验。通过直观的界面设计和强大的功能特性，显著提升用户的工作效率和使用满意度。,https://setapp.com/apps/squash,https://www.realmacsoftware.com/squash,9.99,92,Mac
Slidepad,将最常用的应用保持在手边。这是一款功能丰富的Mac专业应用，为用户提供高效便捷的工作体验。通过直观的界面设计和强大的功能特性，显著提升用户的工作效率和使用满意度。,https://setapp.com/apps/slidepad,https://slidepad.xyz,9.99,92,Mac
MarginNote,更高效地学习。这是一款功能丰富的Mac专业应用，为用户提供高效便捷的工作体验。通过直观的界面设计和强大的功能特性，显著提升用户的工作效率和使用满意度。,https://setapp.com/apps/marginnote,https://www.marginnote.com,99.99,92,Mac
Dropshare,通过文件共享节省空间。高效的文件管理和操作工具，提供强大的文件组织和处理功能。支持批量操作和高级文件管理选项，提升文件处理效率。,https://setapp.com/apps/dropshare,https://dropshare.app,24.99,92,"Mac, iOS"
VidCap,为视频生成字幕。专业的视频处理工具，提供高质量的视频编辑和转换功能。支持多种视频格式和高级编辑选项，满足用户的视频制作需求。,https://setapp.com/apps/vidcap,https://vidcap.app,9.99,92,"Mac, iOS"
Tripsy,在Mac和iOS上规划旅行。这是一款功能丰富的Mac专业应用，为用户提供高效便捷的工作体验。通过直观的界面设计和强大的功能特性，显著提升用户的工作效率和使用满意度。,https://setapp.com/apps/tripsy,https://tripsy.app,4.99,92,"Mac, iOS"
WiFi Signal,监控你的Wi-Fi连接。这是一款功能丰富的Mac专业应用，为用户提供高效便捷的工作体验。通过直观的界面设计和强大的功能特性，显著提升用户的工作效率和使用满意度。,https://setapp.com/apps/wifi-signal,https://www.intuitibits.com/products/wifi-signal,9.99,92,Mac
PDF Search,使用AI在PDF中查找任何内容。这是一款功能丰富的Mac专业应用，为用户提供高效便捷的工作体验。通过直观的界面设计和强大的功能特性，显著提升用户的工作效率和使用满意度。,https://setapp.com/apps/pdf-search,https://pdfsearch.app,9.99,92,"Mac, iOS"
Eter,收听网络电台。专业的网络管理和监控工具，提供详细的网络分析和优化功能。帮助用户诊断网络问题，确保最佳的网络性能和连接质量。,https://setapp.com/apps/eter,https://eter.audio,4.99,92,"Mac, iOS"
Teleprompter App,使用提词器录制视频。专业的视频处理工具，提供高质量的视频编辑和转换功能。支持多种视频格式和高级编辑选项，满足用户的视频制作需求。,https://setapp.com/apps/teleprompter-app,https://teleprompterapp.com,9.99,92,"Mac, iOS"
Boom 3D,提升音量和音频质量。专业的音频处理和音乐管理工具，支持多种音频格式和高质量播放。提供丰富的音频编辑功能和音乐库管理选项。,https://setapp.com/apps/boom-3d,https://www.globaldelight.com/boom,39.99,91,"Mac, iOS"
DisplayBuddy,控制多显示器设置。这是一款功能丰富的Mac专业应用，为用户提供高效便捷的工作体验。通过直观的界面设计和强大的功能特性，显著提升用户的工作效率和使用满意度。,https://setapp.com/apps/displaybuddy,https://displaybuddy.app,19.99,91,Mac
ChatMate for WhatsApp,个性化WhatsApp。这是一款功能丰富的Mac专业应用，为用户提供高效便捷的工作体验。通过直观的界面设计和强大的功能特性，显著提升用户的工作效率和使用满意度。,https://setapp.com/apps/chatmate-for-whatsapp,https://chatmate.io,9.99,91,Mac
Chronicle,跟踪账单和订阅。这是一款功能丰富的Mac专业应用，为用户提供高效便捷的工作体验。通过直观的界面设计和强大的功能特性，显著提升用户的工作效率和使用满意度。,https://setapp.com/apps/chronicle,https://chronicleapp.com,49.99,91,"Mac, iOS"
Diagrams,用图表可视化。这是一款功能丰富的Mac专业应用，为用户提供高效便捷的工作体验。通过直观的界面设计和强大的功能特性，显著提升用户的工作效率和使用满意度。,https://setapp.com/apps/diagrams,https://diagrams.app,9.99,91,Mac
Almighty,解锁50+个Mac快捷方式。这是一款功能丰富的Mac专业应用，为用户提供高效便捷的工作体验。通过直观的界面设计和强大的功能特性，显著提升用户的工作效率和使用满意度。,https://setapp.com/apps/almighty,https://almighty.tools,9.99,91,Mac
Muse,将想法放在单一画布上。这是一款功能丰富的Mac专业应用，为用户提供高效便捷的工作体验。通过直观的界面设计和强大的功能特性，显著提升用户的工作效率和使用满意度。,https://setapp.com/apps/muse,https://museapp.com,9.99,91,"Mac, iOS"
GetAPI,更轻松管理API交互。这是一款功能丰富的Mac专业应用，为用户提供高效便捷的工作体验。通过直观的界面设计和强大的功能特性，显著提升用户的工作效率和使用满意度。,https://setapp.com/apps/getapi,https://getapi.app,9.99,91,Mac
DeskMinder²,创建快速桌面提醒。这是一款功能丰富的Mac专业应用，为用户提供高效便捷的工作体验。通过直观的界面设计和强大的功能特性，显著提升用户的工作效率和使用满意度。,https://setapp.com/apps/deskminder,https://deskminder.com,4.99,91,Mac
TypingMind,使用新UI与AI聊天。这是一款功能丰富的Mac专业应用，为用户提供高效便捷的工作体验。通过直观的界面设计和强大的功能特性，显著提升用户的工作效率和使用满意度。,https://setapp.com/apps/typingmind,https://www.typingmind.com,39,90,"Mac, Web"
NotchNook,从刘海控制Mac。这是一款功能丰富的Mac专业应用，为用户提供高效便捷的工作体验。通过直观的界面设计和强大的功能特性，显著提升用户的工作效率和使用满意度。,https://setapp.com/apps/notchnook,https://lo.cafe/notchnook,9.99,90,Mac
