名称,功能描述,Setapp链接,官方网站,官方订阅价格,评分,平台
Luminar Neo,像专业人士一样改善你的照片。强大的图片处理和管理工具，提供专业的编辑功能和批量处理能力。支持多种图片格式和高级滤镜效果，提升图片质量和视觉效果。,https://setapp.com/apps/luminar-neo,https://skylum.com/luminar-neo,9.95,90,Mac
CameraBag Pro,编辑照片和视频。专业的视频处理工具，提供高质量的视频编辑和转换功能。支持多种视频格式和高级编辑选项，满足用户的视频制作需求。,https://setapp.com/apps/camerabag-pro,https://www.nevercenter.com/camerabag,29.99,90,Mac
Clop,缩小图像、视频、PDF。专业的视频处理工具，提供高质量的视频编辑和转换功能。支持多种视频格式和高级编辑选项，满足用户的视频制作需求。,https://setapp.com/apps/clop,https://lowtechguys.com/clop,0,90,Mac
Focus 2,阻止网站和应用。这是一款功能丰富的Mac专业应用，为用户提供高效便捷的工作体验。通过直观的界面设计和强大的功能特性，显著提升用户的工作效率和使用满意度。,https://setapp.com/apps/focus,https://heyfocus.com,19.99,90,Mac
Moment,创建倒计时事件。这是一款功能丰富的Mac专业应用，为用户提供高效便捷的工作体验。通过直观的界面设计和强大的功能特性，显著提升用户的工作效率和使用满意度。,https://setapp.com/apps/moment,https://fireball.studio/moment,4.99,90,Mac
Daily,轻松跟踪时间。这是一款功能丰富的Mac专业应用，为用户提供高效便捷的工作体验。通过直观的界面设计和强大的功能特性，显著提升用户的工作效率和使用满意度。,https://setapp.com/apps/daily,https://dailytimetracking.com,4.99,90,"Mac, iOS"
Nitro PDF Pro,处理你的PDF。这是一款功能丰富的Mac专业应用，为用户提供高效便捷的工作体验。通过直观的界面设计和强大的功能特性，显著提升用户的工作效率和使用满意度。,https://setapp.com/apps/nitro-pdf-pro,https://www.gonitro.com,155.88,89,"Mac, iOS"
Spark Mail,更轻松管理邮件。这是一款功能丰富的Mac专业应用，为用户提供高效便捷的工作体验。通过直观的界面设计和强大的功能特性，显著提升用户的工作效率和使用满意度。,https://setapp.com/apps/spark-mail,https://sparkmailapp.com,7.99,89,"Mac, iOS"
World Clock Pro,跨时区工作。这是一款功能丰富的Mac专业应用，为用户提供高效便捷的工作体验。通过直观的界面设计和强大的功能特性，显著提升用户的工作效率和使用满意度。,https://setapp.com/apps/world-clock-pro,https://worldclockpro.com,9.99,89,"Mac, iOS"
iBoysoft MagicMenu,扩展Mac的右键菜单。这是一款功能丰富的Mac专业应用，为用户提供高效便捷的工作体验。通过直观的界面设计和强大的功能特性，显著提升用户的工作效率和使用满意度。,https://setapp.com/apps/iboysoft-magicmenu,https://iboysoft.com/magic-menu,19.95,89,Mac
PDF Pals,与你的PDF聊天。这是一款功能丰富的Mac专业应用，为用户提供高效便捷的工作体验。通过直观的界面设计和强大的功能特性，显著提升用户的工作效率和使用满意度。,https://setapp.com/apps/pdf-pals,https://pdfpals.com,9.99,89,Mac
ClearVPN,使用直观的VPN。这是一款功能丰富的Mac专业应用，为用户提供高效便捷的工作体验。通过直观的界面设计和强大的功能特性，显著提升用户的工作效率和使用满意度。,https://setapp.com/apps/clearvpn,https://clearvpn.com,9.99,88,"Mac, iOS"
Batteries,跟踪所有设备的电池电量。这是一款功能丰富的Mac专业应用，为用户提供高效便捷的工作体验。通过直观的界面设计和强大的功能特性，显著提升用户的工作效率和使用满意度。,https://setapp.com/apps/batteries,https://www.fadel.io/batteries,9.99,88,Mac
WidgetWall,向Mac桌面添加小部件。这是一款功能丰富的Mac专业应用，为用户提供高效便捷的工作体验。通过直观的界面设计和强大的功能特性，显著提升用户的工作效率和使用满意度。,https://setapp.com/apps/widget-wall,https://www.widgetwall.app,9.99,88,Mac
WallCal,将清晰的日历固定到桌面。这是一款功能丰富的Mac专业应用，为用户提供高效便捷的工作体验。通过直观的界面设计和强大的功能特性，显著提升用户的工作效率和使用满意度。,https://setapp.com/apps/wallcal,https://wallcal.com,4.99,88,Mac
Expenses,跟踪你的支出。这是一款功能丰富的Mac专业应用，为用户提供高效便捷的工作体验。通过直观的界面设计和强大的功能特性，显著提升用户的工作效率和使用满意度。,https://setapp.com/apps/expenses,https://getexpenses.app,4.99,88,"Mac, iOS"
Focused Work,使用计时器工作。这是一款功能丰富的Mac专业应用，为用户提供高效便捷的工作体验。通过直观的界面设计和强大的功能特性，显著提升用户的工作效率和使用满意度。,https://setapp.com/apps/focused-work-mac,https://focusedwork.app,4.99,88,"Mac, iOS"
Capto,创建屏幕录制。这是一款功能丰富的Mac专业应用，为用户提供高效便捷的工作体验。通过直观的界面设计和强大的功能特性，显著提升用户的工作效率和使用满意度。,https://setapp.com/apps/capto,https://www.globaldelight.com/capto,29.99,87,Mac
Elephas,使用AI管理知识。这是一款功能丰富的Mac专业应用，为用户提供高效便捷的工作体验。通过直观的界面设计和强大的功能特性，显著提升用户的工作效率和使用满意度。,https://setapp.com/apps/elephas,https://elephas.app,14.99,87,"Mac, iOS"
GetSound,使用AI音景专注。这是一款功能丰富的Mac专业应用，为用户提供高效便捷的工作体验。通过直观的界面设计和强大的功能特性，显著提升用户的工作效率和使用满意度。,https://setapp.com/apps/getsound,https://getsound.ai,9.99,87,Mac
iMeetingX,有效运行会议。这是一款功能丰富的Mac专业应用，为用户提供高效便捷的工作体验。通过直观的界面设计和强大的功能特性，显著提升用户的工作效率和使用满意度。,https://setapp.com/apps/imeetingx,https://imeetingx.com,9.99,87,Mac
iBoysoft NTFS for Mac,读写NTFS驱动器。这是一款功能丰富的Mac专业应用，为用户提供高效便捷的工作体验。通过直观的界面设计和强大的功能特性，显著提升用户的工作效率和使用满意度。,https://setapp.com/apps/iboysoft-ntfs-for-mac,https://iboysoft.com/ntfs-for-mac,39.95,86,Mac
Vivid,双倍显示亮度。这是一款功能丰富的Mac专业应用，为用户提供高效便捷的工作体验。通过直观的界面设计和强大的功能特性，显著提升用户的工作效率和使用满意度。,https://setapp.com/apps/vivid,https://www.getvivid.app,14.99,86,Mac
Get Backup Pro,仅备份重要文件。高效的文件管理和操作工具，提供强大的文件组织和处理功能。支持批量操作和高级文件管理选项，提升文件处理效率。,https://setapp.com/apps/get-backup-pro,https://www.belightsoft.com/products/getbackup,19.95,86,Mac
Plus,使用AI处理文本。专业的文本编辑和处理工具，提供丰富的编辑功能和格式支持。帮助用户高效处理文档内容，提升写作和编辑体验。,https://setapp.com/apps/plus,https://www.plusdocs.com,10,86,Mac
SheetPlanner,规划和跟踪项目进度。这是一款功能丰富的Mac专业应用，为用户提供高效便捷的工作体验。通过直观的界面设计和强大的功能特性，显著提升用户的工作效率和使用满意度。,https://setapp.com/apps/sheetplanner,https://sheetplanner.com,9.99,86,Mac
KeyCue,使用快捷方式更快工作。这是一款功能丰富的Mac专业应用，为用户提供高效便捷的工作体验。通过直观的界面设计和强大的功能特性，显著提升用户的工作效率和使用满意度。,https://setapp.com/apps/keycue,https://www.ergonis.com/products/keycue,19.99,86,Mac
Focus,阻止网站和社交媒体。这是一款功能丰富的Mac专业应用，为用户提供高效便捷的工作体验。通过直观的界面设计和强大的功能特性，显著提升用户的工作效率和使用满意度。,https://setapp.com/apps/focus-mac,https://heyfocus.com,19.99,86,Mac
AnyDroid,在Mac和Android之间移动文件。高效的文件管理和操作工具，提供强大的文件组织和处理功能。支持批量操作和高级文件管理选项，提升文件处理效率。,https://setapp.com/apps/anytrans-for-android,https://www.imobie.com/anytrans-for-android,39.99,85,Mac
PliimPRO,无干扰屏幕共享。这是一款功能丰富的Mac专业应用，为用户提供高效便捷的工作体验。通过直观的界面设计和强大的功能特性，显著提升用户的工作效率和使用满意度。,https://setapp.com/apps/pliimpro,https://pliim.app,9.99,85,Mac
MonsterWriter,轻松编写复杂文本。专业的文本编辑和处理工具，提供丰富的编辑功能和格式支持。帮助用户高效处理文档内容，提升写作和编辑体验。,https://setapp.com/apps/monsterwriter,https://monsterwriter.app,9.99,85,Mac
Clobbr,负载测试API端点。这是一款功能丰富的Mac专业应用，为用户提供高效便捷的工作体验。通过直观的界面设计和强大的功能特性，显著提升用户的工作效率和使用满意度。,https://setapp.com/apps/clobbr,https://clobbr.app,9.99,85,Mac
Invoice Rex,编辑和跟踪发票。这是一款功能丰富的Mac专业应用，为用户提供高效便捷的工作体验。通过直观的界面设计和强大的功能特性，显著提升用户的工作效率和使用满意度。,https://setapp.com/apps/invoice-rex,https://invoicerex.com,9.99,85,"Mac, iOS"
Canary Mail,编写和管理邮件。这是一款功能丰富的Mac专业应用，为用户提供高效便捷的工作体验。通过直观的界面设计和强大的功能特性，显著提升用户的工作效率和使用满意度。,https://setapp.com/apps/canary-mail,https://canarymail.io,49.99,84,"Mac, iOS"
Rocket Typist,使用文本片段节省打字时间。专业的文本编辑和处理工具，提供丰富的编辑功能和格式支持。帮助用户高效处理文档内容，提升写作和编辑体验。,https://setapp.com/apps/rocket-typist,https://witt-software.com/rockettypist,19.99,84,"Mac, iOS"
Calendars,跟踪任务、事件和计划。这是一款功能丰富的Mac专业应用，为用户提供高效便捷的工作体验。通过直观的界面设计和强大的功能特性，显著提升用户的工作效率和使用满意度。,https://setapp.com/apps/calendars,https://readdle.com/calendars,39.99,84,"Mac, iOS"
Spellar AI,使用AI的智能会议笔记。这是一款功能丰富的Mac专业应用，为用户提供高效便捷的工作体验。通过直观的界面设计和强大的功能特性，显著提升用户的工作效率和使用满意度。,https://setapp.com/apps/spellar-ai,https://spellar.ai,8.33,84,"Mac, Web"
GreenBooks,轻松管理资金。这是一款功能丰富的Mac专业应用，为用户提供高效便捷的工作体验。通过直观的界面设计和强大的功能特性，显著提升用户的工作效率和使用满意度。,https://setapp.com/apps/greenbooks,https://www.greenbooksapp.com,4.99,84,"Mac, iOS"
Hustl,创建屏幕延时摄影。这是一款功能丰富的Mac专业应用，为用户提供高效便捷的工作体验。通过直观的界面设计和强大的功能特性，显著提升用户的工作效率和使用满意度。,https://setapp.com/apps/hustl,https://hustl.app,9.99,84,Mac
Smmall Cloud,共享文件并提升你的品牌。高效的文件管理和操作工具，提供强大的文件组织和处理功能。支持批量操作和高级文件管理选项，提升文件处理效率。,https://setapp.com/apps/smmall-cloud,https://smmall.cloud,9.99,84,Mac
Substage,使用自然语言控制Finder。这是一款功能丰富的Mac专业应用，为用户提供高效便捷的工作体验。通过直观的界面设计和强大的功能特性，显著提升用户的工作效率和使用满意度。,https://setapp.com/apps/substage,https://substage.app,9.99,84,Mac
IM+,将所有信使整合到一个。这是一款功能丰富的Mac专业应用，为用户提供高效便捷的工作体验。通过直观的界面设计和强大的功能特性，显著提升用户的工作效率和使用满意度。,https://setapp.com/apps/im+,https://plus.im,19.99,83,Mac
Speeko,在公开演讲方面变得更好。这是一款功能丰富的Mac专业应用，为用户提供高效便捷的工作体验。通过直观的界面设计和强大的功能特性，显著提升用户的工作效率和使用满意度。,https://setapp.com/apps/speeko,https://speeko.co,7.99,83,"Mac, iOS"
Mimir,播放和管理播客。这是一款功能丰富的Mac专业应用，为用户提供高效便捷的工作体验。通过直观的界面设计和强大的功能特性，显著提升用户的工作效率和使用满意度。,https://setapp.com/apps/mimir,https://www.mimirpodcasts.com,4.99,83,"Mac, iOS"
mSecure,存储和同步密码。这是一款功能丰富的Mac专业应用，为用户提供高效便捷的工作体验。通过直观的界面设计和强大的功能特性，显著提升用户的工作效率和使用满意度。,https://setapp.com/apps/msecure,https://www.msecure.com,29.99,83,"Mac, iOS"
UpLife,你的自我护理助手。这是一款功能丰富的Mac专业应用，为用户提供高效便捷的工作体验。通过直观的界面设计和强大的功能特性，显著提升用户的工作效率和使用满意度。,https://setapp.com/apps/uplife-mental-health-therapy-ios,https://uplife.app,9.99,83,iOS
MurmurType,转录你的语音。这是一款功能丰富的Mac专业应用，为用户提供高效便捷的工作体验。通过直观的界面设计和强大的功能特性，显著提升用户的工作效率和使用满意度。,https://setapp.com/apps/murmur,https://murmurtype.com,9.99,82,Mac
WhisperTranscribe,将语音转换为文本内容。专业的文本编辑和处理工具，提供丰富的编辑功能和格式支持。帮助用户高效处理文档内容，提升写作和编辑体验。,https://setapp.com/apps/whisper-transcribe,https://whispertranscribe.com,9.99,82,Mac
DCommander,在双窗格视图中管理文件。高效的文件管理和操作工具，提供强大的文件组织和处理功能。支持批量操作和高级文件管理选项，提升文件处理效率。,https://setapp.com/apps/dcommander,https://devstorm-apps.com/dc,29.99,82,Mac
Silenz,专注模式声音。这是一款功能丰富的Mac专业应用，为用户提供高效便捷的工作体验。通过直观的界面设计和强大的功能特性，显著提升用户的工作效率和使用满意度。,https://setapp.com/apps/silenz,https://silenz.app,4.99,82,Mac
AppWage,跟踪你的应用收入。这是一款功能丰富的Mac专业应用，为用户提供高效便捷的工作体验。通过直观的界面设计和强大的功能特性，显著提升用户的工作效率和使用满意度。,https://setapp.com/apps/appwage,https://appwage.com,9.99,82,Mac
MoneyWiz 2025,预算和管理账单。这是一款功能丰富的Mac专业应用，为用户提供高效便捷的工作体验。通过直观的界面设计和强大的功能特性，显著提升用户的工作效率和使用满意度。,https://setapp.com/apps/moneywiz,https://wiz.money,6.99,81,"Mac, iOS"
Pie Menu,一键访问应用操作。这是一款功能丰富的Mac专业应用，为用户提供高效便捷的工作体验。通过直观的界面设计和强大的功能特性，显著提升用户的工作效率和使用满意度。,https://setapp.com/apps/pie-menu,https://pie-menu.app,9.99,81,Mac
Chimeful,改善专注力并保持正念。这是一款功能丰富的Mac专业应用，为用户提供高效便捷的工作体验。通过直观的界面设计和强大的功能特性，显著提升用户的工作效率和使用满意度。,https://setapp.com/apps/chimeful,https://chimeful.com,4.99,81,Mac
JustStream,将Mac屏幕镜像到电视。这是一款功能丰富的Mac专业应用，为用户提供高效便捷的工作体验。通过直观的界面设计和强大的功能特性，显著提升用户的工作效率和使用满意度。,https://setapp.com/apps/juststream,https://www.elmedia-video-player.com/juststream.html,19.95,80,Mac
Boom,提升你的视频通话。专业的视频处理工具，提供高质量的视频编辑和转换功能。支持多种视频格式和高级编辑选项，满足用户的视频制作需求。,https://setapp.com/apps/boom,https://boom.app,9.99,80,Mac
iShowU,在Mac上录制屏幕。这是一款功能丰富的Mac专业应用，为用户提供高效便捷的工作体验。通过直观的界面设计和强大的功能特性，显著提升用户的工作效率和使用满意度。,https://setapp.com/apps/ishowu,https://www.shinywhitebox.com/ishowu,29.99,80,Mac
Remote Mouse,从手机控制Mac。这是一款功能丰富的Mac专业应用，为用户提供高效便捷的工作体验。通过直观的界面设计和强大的功能特性，显著提升用户的工作效率和使用满意度。,https://setapp.com/apps/remote-mouse,https://www.remotemouse.net,2.99,79,Mac
ByDesign,整理你的工作和生活。这是一款功能丰富的Mac专业应用，为用户提供高效便捷的工作体验。通过直观的界面设计和强大的功能特性，显著提升用户的工作效率和使用满意度。,https://setapp.com/apps/bydesign,https://bydesign.app,9.99,79,"Mac, iOS, Web"
AnyTrans for iOS,在macOS和iOS之间移动文件。高效的文件管理和操作工具，提供强大的文件组织和处理功能。支持批量操作和高级文件管理选项，提升文件处理效率。,https://setapp.com/apps/anytrans,https://www.imobie.com/anytrans,59.99,78,Mac
Backtrack,录制过去的音频。专业的音频处理和音乐管理工具，支持多种音频格式和高质量播放。提供丰富的音频编辑功能和音乐库管理选项。,https://setapp.com/apps/backtrack,https://backtrack.team,5,78,Mac
Taskheat,学会优先处理任务。这是一款功能丰富的Mac专业应用，为用户提供高效便捷的工作体验。通过直观的界面设计和强大的功能特性，显著提升用户的工作效率和使用满意度。,https://setapp.com/apps/taskheat,https://eyen.fr/taskheat,4.99,78,"Mac, iOS"
FreeYourMusic,转移你的播放列表。专业的音频处理和音乐管理工具，支持多种音频格式和高质量播放。提供丰富的音频编辑功能和音乐库管理选项。,https://setapp.com/apps/freeyourmusic,https://freeyourmusic.com,9.99,78,"Mac, iOS"
Simon,控制和故障排除服务器。这是一款功能丰富的Mac专业应用，为用户提供高效便捷的工作体验。通过直观的界面设计和强大的功能特性，显著提升用户的工作效率和使用满意度。,https://setapp.com/apps/simon,https://www.dejal.com/simon,99,78,Mac
Secrets 4,存储和管理密码。这是一款功能丰富的Mac专业应用，为用户提供高效便捷的工作体验。通过直观的界面设计和强大的功能特性，显著提升用户的工作效率和使用满意度。,https://setapp.com/apps/secrets,https://outercorner.com/secrets-ios,9.99,77,"Mac, iOS"
Subjects,跟踪课程表、作业。这是一款功能丰富的Mac专业应用，为用户提供高效便捷的工作体验。通过直观的界面设计和强大的功能特性，显著提升用户的工作效率和使用满意度。,https://setapp.com/apps/subjects,https://eyen.fr/subjects,4.99,76,"Mac, iOS"
TeaCode,使用扩展器加速编码。这是一款功能丰富的Mac专业应用，为用户提供高效便捷的工作体验。通过直观的界面设计和强大的功能特性，显著提升用户的工作效率和使用满意度。,https://setapp.com/apps/teacode,https://www.apptorium.com/teacode,9.99,76,Mac
Keep It Shot,使用AI重命名截图。这是一款功能丰富的Mac专业应用，为用户提供高效便捷的工作体验。通过直观的界面设计和强大的功能特性，显著提升用户的工作效率和使用满意度。,https://setapp.com/apps/keep-it-shot,https://keepitshot.app,4.99,75,Mac
Lacona,告诉你的Mac要做什么。这是一款功能丰富的Mac专业应用，为用户提供高效便捷的工作体验。通过直观的界面设计和强大的功能特性，显著提升用户的工作效率和使用满意度。,https://setapp.com/apps/lacona,https://lacona.app,19.99,75,Mac
Moonitor,接收加密货币的实时更新。这是一款功能丰富的Mac专业应用，为用户提供高效便捷的工作体验。通过直观的界面设计和强大的功能特性，显著提升用户的工作效率和使用满意度。,https://setapp.com/apps/moonitor,https://moonitor.io,4.99,75,Mac
Coherence X,将网站转换为应用。这是一款功能丰富的Mac专业应用，为用户提供高效便捷的工作体验。通过直观的界面设计和强大的功能特性，显著提升用户的工作效率和使用满意度。,https://setapp.com/apps/coherence-pro,https://coherence-x.com,9.99,74,Mac
CleanPresenter,展示单个窗口。这是一款功能丰富的Mac专业应用，为用户提供高效便捷的工作体验。通过直观的界面设计和强大的功能特性，显著提升用户的工作效率和使用满意度。,https://setapp.com/apps/cleanpresenter,https://cleanpresenter.com,9.99,73,Mac
Spotless,自动隐藏文件和清理。高效的文件管理和操作工具，提供强大的文件组织和处理功能。支持批量操作和高级文件管理选项，提升文件处理效率。,https://setapp.com/apps/spotless,https://www.lightpillar.com/spotless.html,9.99,73,Mac
Numerics,监控你的业务数据。这是一款功能丰富的Mac专业应用，为用户提供高效便捷的工作体验。通过直观的界面设计和强大的功能特性，显著提升用户的工作效率和使用满意度。,https://setapp.com/apps/numerics,https://cynapse.com/numerics,19.99,73,"Mac, iOS"
Filmage Editor,像专业人士一样轻松编辑视频。专业的视频处理工具，提供高质量的视频编辑和转换功能。支持多种视频格式和高级编辑选项，满足用户的视频制作需求。,https://setapp.com/apps/filmage-editor,https://filmage.app,59.99,72,Mac
AdLock,阻止烦人的浏览器广告。这是一款功能丰富的Mac专业应用，为用户提供高效便捷的工作体验。通过直观的界面设计和强大的功能特性，显著提升用户的工作效率和使用满意度。,https://setapp.com/apps/adlock,https://adlock.com,2.99,70,"Mac, iOS"
Headway,获取非虚构类书籍摘要。这是一款功能丰富的Mac专业应用，为用户提供高效便捷的工作体验。通过直观的界面设计和强大的功能特性，显著提升用户的工作效率和使用满意度。,https://setapp.com/apps/headway,https://headway.onelink.me,89.99,68,"iOS, Web"
Unite,从网站创建应用。这是一款功能丰富的Mac专业应用，为用户提供高效便捷的工作体验。通过直观的界面设计和强大的功能特性，显著提升用户的工作效率和使用满意度。,https://setapp.com/apps/unite,https://bzgapps.com/unite,19.99,67,Mac
Mental Walk,反思你的生活。这是一款功能丰富的Mac专业应用，为用户提供高效便捷的工作体验。通过直观的界面设计和强大的功能特性，显著提升用户的工作效率和使用满意度。,https://setapp.com/apps/mentalwalk,https://mentalwalk.com,4.99,67,Mac
Tab Finder,在一个地方查看所有浏览器的标签。这是一款功能丰富的Mac专业应用，为用户提供高效便捷的工作体验。通过直观的界面设计和强大的功能特性，显著提升用户的工作效率和使用满意度。,https://setapp.com/apps/tabfinder,https://tabfinder.app,9.99,66,Mac
n-Track Studio,在Mac上录制和编辑音乐。专业的音频处理和音乐管理工具，支持多种音频格式和高质量播放。提供丰富的音频编辑功能和音乐库管理选项。,https://setapp.com/apps/n-track-studio,https://ntrack.com,69,66,Mac
Sidebar,尝试Dock替代方案。这是一款功能丰富的Mac专业应用，为用户提供高效便捷的工作体验。通过直观的界面设计和强大的功能特性，显著提升用户的工作效率和使用满意度。,https://setapp.com/apps/sidebar,https://sidebarapp.net,9.99,64,Mac
TaoGit,使用Git简化你的工作。这是一款功能丰富的Mac专业应用，为用户提供高效便捷的工作体验。通过直观的界面设计和强大的功能特性，显著提升用户的工作效率和使用满意度。,https://setapp.com/apps/taogit,https://taogit.com,9.99,61,Mac
SwiftyLaunch,更快构建iOS应用。这是一款功能丰富的Mac专业应用，为用户提供高效便捷的工作体验。通过直观的界面设计和强大的功能特性，显著提升用户的工作效率和使用满意度。,https://setapp.com/apps/swiftylaunch,https://swiftylaunch.com,9.99,60,Mac
CleanMy®Phone,整理你的iPhone。这是一款功能丰富的Mac专业应用，为用户提供高效便捷的工作体验。通过直观的界面设计和强大的功能特性，显著提升用户的工作效率和使用满意度。,https://setapp.com/apps/gemini-photos,https://macpaw.com/cleanmyphone,7.99,59,iOS
